{"base_count":6,"bound_artifact_hashes_match":true,"case_count":41,"decision":"NO-GO","dummy_analysis_planned_row_count":1480,"dummy_analysis_status":"implemented_validated_not_frozen","dummy_analysis_valid":true,"errors":[],"external_reproduction_mandatory":true,"freeze_permitted":false,"pending_compatibility_row_count":54,"policy_schema_sha256":"f52eca029193a42193baf9e7f56e024277ee8c4747be8c91cb5ac1e808a04de5","policy_sha256":"e25779a38cc23b376facc849b0520b326005e53c0b3ddd67c6c8f6d3208c188a","profile_count":4,"proposition_count":12,"read_scope":{"confirmatory_artifacts_read":false,"independent_review_performed":false,"oracle_join_performed":false,"verifier_results_read":false},"runner_confirmatory_execution_permitted":false,"runner_contract_hashes_match":true,"runner_contract_open_control_count":11,"runner_contract_passed_test_count":61,"runner_contract_status":"synthetic_contract_tests_passed_production_controls_open","runner_contract_test_record_sha256":"95067325dd2a8f8078d09a4a94af7c2bbf4f6a28e0b98e5950d2b97f7c4cae30","runner_contract_test_record_valid":true,"runner_rg006_complete":false,"schema_version":"amy.run-execution-policy-validation.v1-draft","valid":true,"validator_sha256":"d91219aa580681fed734a7ba706eabb226a2838487c2beb8206137d0b0b33463","warnings":["54 compatibility rows remain pending","dummy analysis is implemented_validated_not_frozen","run policy status is draft_runner_contract_tests_passed_pending_isolation_authentication_review_and_freeze","runner contract forbids confirmatory execution","RG-006 remains incomplete with 11 open controls"]}
